{
  "schema": "floorplan.plan",
  "schema_version": "1.1.0",
  "units": {
    "length": "m",
    "area": "m2",
    "angle": "deg",
    "height": "m"
  },
  "coordinate_frame": {
    "name": "aligned_plan",
    "description": "Metric 2-D plan coordinates (u, v) = (x, z) of the capture's gravity- and Manhattan-aligned world frame. The 3-D frame is right-handed with +y up, so when the plan is viewed from above, +u points right and +v points DOWN the page (drawing +v upward mirrors the plan). The origin and heading are arbitrary per capture (wherever the phone started, rotated so the dominant walls run along u and v).",
    "plan_axes": [
      "u = x (m)",
      "v = z (m)"
    ],
    "up_axis": "+y",
    "handedness": "right",
    "view_from_above": {
      "u": "right",
      "v": "down"
    },
    "heights": "metres above the room's own floor; floor_level is the floor height in the aligned frame"
  },
  "capture_id": "synthetic_apartment",
  "tier": "lidar",
  "footprint_area": {
    "value": 55.63,
    "ci95": [55.4972, 55.7628],
    "unit": "m2",
    "method": "sum of room areas",
    "status": "measured"
  },
  "rooms": [
    {
      "id": "corridor",
      "label": "Corridor",
      "polygon": [
        [0.0, 0.0],
        [1.2, 0.0],
        [1.2, 4.0],
        [5.0, 4.0],
        [5.0, 5.2],
        [0.0, 5.2]
      ],
      "wall_ids": [
        "corridor_w0",
        "corridor_w1",
        "corridor_w2",
        "corridor_w3",
        "corridor_w4",
        "corridor_w5"
      ],
      "floor_area": {
        "value": 10.8,
        "ci95": [10.72, 10.88],
        "unit": "m2",
        "method": "polygon area",
        "status": "measured"
      },
      "perimeter": {
        "value": 20.4,
        "ci95": [20.3808, 20.4192],
        "unit": "m",
        "method": "sum of wall lengths",
        "status": "measured"
      },
      "ceiling_height": {
        "value": 2.62,
        "ci95": [2.6122, 2.6278],
        "unit": "m",
        "method": "floor/ceiling plane fit",
        "status": "measured"
      },
      "bbox_dims": {
        "length": {
          "value": 5.2,
          "ci95": [5.1922, 5.2078],
          "unit": "m",
          "method": "aligned bbox",
          "status": "measured"
        },
        "width": {
          "value": 5.0,
          "ci95": [4.9922, 5.0078],
          "unit": "m",
          "method": "aligned bbox",
          "status": "measured"
        }
      },
      "floor_level": -1.5
    },
    {
      "id": "living",
      "label": "Living room",
      "polygon": [
        [1.3, 0.0],
        [4.6, 0.0],
        [5.6, 1.0],
        [5.6, 3.9],
        [1.3, 3.9]
      ],
      "wall_ids": [
        "living_w0",
        "living_w1",
        "living_w2",
        "living_w3",
        "living_w4"
      ],
      "floor_area": {
        "value": 16.27,
        "ci95": [16.208, 16.332],
        "unit": "m2",
        "method": "polygon area",
        "status": "measured"
      },
      "perimeter": {
        "value": 15.8142,
        "ci95": [15.7967, 15.8317],
        "unit": "m",
        "method": "sum of wall lengths",
        "status": "measured"
      },
      "ceiling_height": {
        "value": 2.71,
        "ci95": [2.7022, 2.7178],
        "unit": "m",
        "method": "floor/ceiling plane fit",
        "status": "measured"
      },
      "bbox_dims": {
        "length": {
          "value": 4.3,
          "ci95": [4.2922, 4.3078],
          "unit": "m",
          "method": "aligned bbox",
          "status": "measured"
        },
        "width": {
          "value": 3.9,
          "ci95": [3.8922, 3.9078],
          "unit": "m",
          "method": "aligned bbox",
          "status": "measured"
        }
      },
      "floor_level": -1.5
    },
    {
      "id": "kitchen",
      "label": "Kitchen",
      "polygon": [
        [5.1, 4.0],
        [7.6, 4.0],
        [7.6, 8.8],
        [5.1, 8.8]
      ],
      "wall_ids": [
        "kitchen_w0",
        "kitchen_w1",
        "kitchen_w2",
        "kitchen_w3"
      ],
      "floor_area": {
        "value": 12.0,
        "ci95": [11.9428, 12.0572],
        "unit": "m2",
        "method": "polygon area",
        "status": "measured"
      },
      "perimeter": {
        "value": 14.6,
        "ci95": [14.5843, 14.6157],
        "unit": "m",
        "method": "sum of wall lengths",
        "status": "measured"
      },
      "ceiling_height": {
        "value": 2.7,
        "ci95": [2.6922, 2.7078],
        "unit": "m",
        "method": "floor/ceiling plane fit",
        "status": "measured"
      },
      "bbox_dims": {
        "length": {
          "value": 4.8,
          "ci95": [4.7922, 4.8078],
          "unit": "m",
          "method": "aligned bbox",
          "status": "measured"
        },
        "width": {
          "value": 2.5,
          "ci95": [2.4922, 2.5078],
          "unit": "m",
          "method": "aligned bbox",
          "status": "measured"
        }
      },
      "floor_level": -1.5
    },
    {
      "id": "bedroom",
      "label": "Bedroom",
      "polygon": [
        [0.0, 5.3],
        [3.4, 5.3],
        [3.4, 8.8],
        [0.0, 8.8]
      ],
      "wall_ids": [
        "bedroom_w0",
        "bedroom_w1",
        "bedroom_w2",
        "bedroom_w3"
      ],
      "floor_area": {
        "value": 11.9,
        "ci95": [11.8459, 11.9541],
        "unit": "m2",
        "method": "polygon area",
        "status": "measured"
      },
      "perimeter": {
        "value": 13.8,
        "ci95": [13.7843, 13.8157],
        "unit": "m",
        "method": "sum of wall lengths",
        "status": "measured"
      },
      "ceiling_height": {
        "value": 2.7,
        "ci95": [2.6922, 2.7078],
        "unit": "m",
        "method": "floor/ceiling plane fit",
        "status": "measured"
      },
      "bbox_dims": {
        "length": {
          "value": 3.5,
          "ci95": [3.4922, 3.5078],
          "unit": "m",
          "method": "aligned bbox",
          "status": "measured"
        },
        "width": {
          "value": 3.4,
          "ci95": [3.3922, 3.4078],
          "unit": "m",
          "method": "aligned bbox",
          "status": "measured"
        }
      },
      "floor_level": -1.5
    },
    {
      "id": "bathroom",
      "label": "Bathroom",
      "polygon": [
        [3.5, 5.3],
        [5.0, 5.3],
        [5.0, 7.6],
        [3.5, 7.6]
      ],
      "wall_ids": [
        "bathroom_w0",
        "bathroom_w1",
        "bathroom_w2",
        "bathroom_w3"
      ],
      "floor_area": {
        "value": 3.45,
        "ci95": [3.4202, 3.4798],
        "unit": "m2",
        "method": "polygon area",
        "status": "measured"
      },
      "perimeter": {
        "value": 7.6,
        "ci95": [7.5843, 7.6157],
        "unit": "m",
        "method": "sum of wall lengths",
        "status": "measured"
      },
      "ceiling_height": {
        "value": 2.45,
        "ci95": [2.4422, 2.4578],
        "unit": "m",
        "method": "floor/ceiling plane fit",
        "status": "measured"
      },
      "bbox_dims": {
        "length": {
          "value": 2.3,
          "ci95": [2.2922, 2.3078],
          "unit": "m",
          "method": "aligned bbox",
          "status": "measured"
        },
        "width": {
          "value": 1.5,
          "ci95": [1.4922, 1.5078],
          "unit": "m",
          "method": "aligned bbox",
          "status": "measured"
        }
      },
      "floor_level": -1.5
    },
    {
      "id": "wc",
      "label": "WC",
      "polygon": [
        [3.5, 7.7],
        [4.6, 7.7],
        [4.6, 8.8],
        [3.5, 8.8]
      ],
      "wall_ids": [
        "wc_w0",
        "wc_w1",
        "wc_w2",
        "wc_w3"
      ],
      "floor_area": {
        "value": 1.21,
        "ci95": [1.1928, 1.2272],
        "unit": "m2",
        "method": "polygon area",
        "status": "measured"
      },
      "perimeter": {
        "value": 4.4,
        "ci95": [4.3843, 4.4157],
        "unit": "m",
        "method": "sum of wall lengths",
        "status": "measured"
      },
      "ceiling_height": {
        "value": null,
        "ci95": null,
        "unit": "m",
        "method": "floor/ceiling plane fit; ceiling not in view",
        "status": "not_observed"
      },
      "bbox_dims": {
        "length": {
          "value": 1.1,
          "ci95": [1.0922, 1.1078],
          "unit": "m",
          "method": "aligned bbox",
          "status": "measured"
        },
        "width": {
          "value": 1.1,
          "ci95": [1.0922, 1.1078],
          "unit": "m",
          "method": "aligned bbox",
          "status": "measured"
        }
      },
      "floor_level": -1.5
    }
  ],
  "walls": [
    {
      "id": "corridor_w0",
      "room_id": "corridor",
      "p0": [0.0, 0.0],
      "p1": [1.2, 0.0],
      "length": {
        "value": 1.2,
        "ci95": [1.1922, 1.2078],
        "unit": "m",
        "method": "plane-fit corner to corner",
        "status": "measured"
      },
      "normal": [-0.0, 1.0],
      "thickness": null,
      "opening_ids": [
        "o_entry"
      ],
      "support_points": 4800,
      "fit_rmse_m": 0.003
    },
    {
      "id": "corridor_w1",
      "room_id": "corridor",
      "p0": [1.2, 0.0],
      "p1": [1.2, 4.0],
      "length": {
        "value": 4.0,
        "ci95": [3.9922, 4.0078],
        "unit": "m",
        "method": "plane-fit corner to corner",
        "status": "measured"
      },
      "normal": [-1.0, 0.0],
      "thickness": {
        "value": 0.1,
        "ci95": [0.0882, 0.1118],
        "unit": "m",
        "method": "distance between the two wall faces",
        "status": "measured"
      },
      "opening_ids": [
        "o_living"
      ],
      "support_points": 16000,
      "fit_rmse_m": 0.003
    },
    {
      "id": "corridor_w2",
      "room_id": "corridor",
      "p0": [1.2, 4.0],
      "p1": [5.0, 4.0],
      "length": {
        "value": 3.8,
        "ci95": [3.7922, 3.8078],